Name,title,coding
t3_jxocbx,[Not Satire] National Democratic Party official suggests re-education for Trump supporters: 'How do you deprogram 75 million people?',NA
t3_jxf1do,BREAKING: Georgia manual recount confirms Biden victory,VOTE COUNT
t3_jxraf0,"While You Were Focused on The Kraken, the Senate Continued Confirming Trump Federal Judges",DOMESTIC
t3_jxnh2b,Lawyer working on Trump Pennsylvania effort placed under official protection due to threats,LEGAL
t3_jxod6m,'No national shutdown': Joe Biden says shutting down the virus will not require a national lockdown,COVID
t3_jxochk,"New Senate report purportedly 'confirms' Biden family's business ties to Chinese, Russian governments",FOREIGN
t3_jxrzlp,Obama Tells Jimmy Kimmel: 'We Can Always Send the Navy SEALS' to Remove Trump from White House,STEAL
t3_jxo83f,Hunter Biden had deep business ties with communist party-linked Chinese tycoon: new Senate report,FOREIGN
t3_jxny9j,Trump Legal Adviser Jenna Ellis Rips Media: ‘You Are Not Unbiased Jurors’,LEGAL
t3_jxrnvy,Tucker Carlson​ says Trump attorney Sidney Powell wouldn't provide him with any evidence of election fraud. Powell hits back.,STEAL
t3_jxq1j3,Joe Biden stays silent over proposed meeting with BLM founder,DOMESTIC
t3_jxgzoc,Trump campaign statement on Georgia,DOMESTIC
t3_jxtoaq,"Georgia certifies election results, making Biden win official",VOTE COUNT
t3_jxnwph,Catholic Bishop: 'I Beg Mr. Biden to Repent of His Dissent From Catholic Teaching on Abortion &amp; Marriage',DOMESTIC
t3_jx9ucr,Trump Campaign Says It Has Uncovered Enough ‘Fraud’ To Overturn Election Result,STEAL
t3_jxow0s,Satire: Obama: 'Biden Has Touched Us All',NA
t3_jxsv1q,Trump Campaign Fact-Checks the Media: Georgia Has Not Certified Biden's Win,STEAL
t3_jxtkh6,Georgia Secretary of State Certifies Biden’s Win After Audit,VOTE COUNT
t3_jxb0sk,"Michigan, 6:31 AM, 150,000 votes, 96% for Biden...nothing to see here",VOTE COUNT
t3_jxtmra,"'We are a nation of laws, not tweets': Republican Sens. Romney and Sasse decry Trump efforts to challenge election",STEAL
t3_jxj0e4,"Major LGBT Group Urges Biden to Strip Accreditation of Christian Schools, Colleges",DOMESTIC
t3_jxmbiw,Joe Biden Keeps Lead in Georgia After Recount; Giuliani Says Recount ‘Means Nothing’,STEAL
t3_jxsxuq,National Democratic Party official suggests re-education for Trump supporters: 'How do you deprogram 75 million people?',NA
t3_jxdkfu,NRA Presents Biden With Prestigious 'Gun Salesman Of The Month' Award,DOMESTIC
t3_jxsfmb,Whoa: Nearly a Third of Democrats Believe the Election Was Stolen From Trump,STEAL
t3_jxgnco,Tucker Carlson Unloads On Trump Lawyer Sidney Powell Over Wild Election Claims: The Truth Matters,STEAL
t3_jxnvxb,"After UN ‘Database’ Targets Israeli Settlements, Trump Administration to Blacklist BDS Supporters",FOREIGN
t3_jxqrev,Giuliani: ‘Massive Fraud’: Trump lawyers present chapter and verse in presser,STEAL
t3_jxp6c1,Top Border Officials Warn About Disastrous Effects of Biden's Promise to Stop Building the Border Wall,DOMESTIC
t3_jxp42s,Mitt Romney issues scathing statement condemning President Trump's voter fraud claims,STEAL
t3_jx2oik,Twitter CEO Admits His Company Was ‘Wrong’ To Censor Hunter Biden Story,DOMESTIC
t3_jxqcon,Biden Deputy Chief of Staff Pushed 'Mandatory' Firearm Buybacks,DOMESTIC
t3_jxpzsx,Georgia Secretary of State to certify election for Biden,VOTE COUNT
t3_jx82xb,'We no longer have' an 'honest press' -- Commentator: Media 'casually compares Trump to Hitler' because it's 'what they believe',MEDIA
t3_jxdwum,"Sidney Powell: Absent software fraud, Trump 'had at least 80 million votes'",STEAL
t3_jx9880,Giuliani: 'Massive Fraud' Used to Steal Election From Trump,STEAL
t3_jxorjf,"Biden’s COVID Plan: Close The Economy, Open The Border",COVID
t3_jxtjcf,Paul Krugman spotted doing a quick economic one-eighty with 'Biden boom' prediction,DOMESTIC
t3_jxr35h,Biden marks Transgender Day of Remembrance,DOMESTIC
t3_jxsj5w,AOC to Biden Administration: 'Keep Your Promise' on $2T Green New Deal,DOMESTIC
t3_jxtpep,"Trump Lawyer Sidney Powell Responds to Tucker Carlson: 'He Was Insulting, Demanding and Rude'",LEGAL
t3_jx81g0,Donald Trump Called to Support Michigan Canvassing Board Members After Threats,STEAL
t3_jxnw1z,Atlanta Mayor Suggests Trump Would ‘Eat His Own Children’ To Advance Agenda,DOMESTIC
t3_jxs8st,Biden Appoints ‘Anti-Free Speech’ Richard Stengel to Transition Team Media Post,MEDIA
t3_jx8yo5,"4th witness, also a Democrat saw perfect black marks on a stack of ballots ... 500 in a row all for Biden",STEAL
t3_jxs0up,Biden Deputy Chief of Staff Pushed 'Mandatory' Firearm Buybacks,DOMESTIC
t3_jxtalp,Intimidation Tactics Against Trump Lawyers Undermine Justice,LEGAL
t3_jxdm04,"Lin Wood loses motion to stop certification, Trump vows to file another ‘major lawsuit’ against Georgia election",LEGAL
t3_jx8nk9,"If Biden Can Take Power by Fraud, Our Republic Has Abolished Itself",STEAL
t3_jxtyny,Insider Tells What It’s Really Like In The Trump White House: Cordial And Efficient,DOMESTIC
t3_jxib3j,Trump Campaign Advisor Boris Epshteyn: Reporters 'Taken Aback' by Evidence Presented By Trump's Lawyers,LEGAL
t3_jx29dj,"3rd monitor, a Democrat: ""Hundreds of these ballots seemed impeccable, with no folds or creases. The bubble selections were perfectly made ... only observed selections in black ink, and all happened to be selections for Biden.""",STEAL
t3_jxtm8p,Hoyer on Trump election challenges: 'I think this borders on treason',STEAL
t3_jx2ieq,"New York Times op-ed admits 'Trump was right,' Democrats 'wrong,' about keeping schools open ""Some things are true even though President Trump says them""",COVID
t3_jxijt4,Biden Says He Will Admit and Grant Permanent Status to Immigrants Who Go on Food Stamps and Medicaid,DOMESTIC
t3_jxnr50,Lara Trump mulling 2022 Senate run in North Carolina: report,DOMESTIC
t3_jxgcqs,"Georgia recount results: Biden still ahead by 12,000 — but Trump has one last roll of the dice",VOTE COUNT
t3_jxtrfn,Biden Says He Discussed National Mask Mandate With Governors During Meeting,COVID
t3_jx6jqo,Trump To Release “Clear Path To Victory” Today At High Noon!,VOTE COUNT
t3_jx86aj,Satire: Biden Getting Excited As Segregation Coming Back Into Style,NA
t3_jxez6k,Joe Biden Holds Lead in Georgia After Hand Recount,VOTE COUNT
t3_jxdun5,"After Insulting Trump Voters For Years, NYT Writer Complains Reaching Out To Them Is A 'Waste Of Time'",MEDIA
t3_jx9mc7,"Majority of voters say special counsel should be convened to investigate Biden, Ukraine dealings",STEAL
t3_jx80n2,Trump Campaign Lawyers: There is a Pattern of Planned Voter Fraud in Multiple States,LEGAL
t3_jxqize,"‘Code Monkey’ and ‘Inventor of Email’, Are Said to Be Assisting Trump in Exposing Dominion Voting Systems",STEAL
t3_jxd71m,Butterball Releases Turkey With Biden-Harris Logo So You Can Just Say Your Thanksgiving Gathering Is A Political Rally,NA
t3_jx49x7,"Facebook's Election Fact Checker Honored Biden In 2017, Employees Donated EXCLUSIVELY to Democrats in 2020",MEDIA
t3_jxg84e,NRA Presents Biden With Prestigious 'Gun Salesman Of The Month' Award,DOMESTIC
t3_jxem59,"When Proven Liars Say Trump's Chances Are Slim, It's Time to Listen to Honest Folk Who Know the Score Instead",STEAL
t3_jx86xn,Romney: Surprising People Believe Trump's Fraud Claims,STEAL
t3_jxh2vl,Trump campaign lawyer under protection following ‘threats of harm’,LEGAL
t3_jxaesw,9 Key Points from Trump Campaign Press Conference on Challenges to Election Results,STEAL
t3_jwzkyn,Trump campaign lawyer under protection following ‘threats of harm’,LEGAL
t3_jwwroq,"TRUMP: Biden receives a dump of 143,379 votes at 3:42AM a day after the election",STEAL
t3_jxhnj4,"4th Georgia County Finds Memory Card With Uncounted Votes, Most for Biden",STEAL
t3_jx4rfm,A Poll was released this morning trying to track trends into 2024 and the majority of deceased voters say they will vote again for Biden.,STEAL
t3_jx825w,Catholic Archbishop Sends Dire Warning to Trump About the Radical ‘Great Reset’ Movement,DOMESTIC
t3_jxb2fj,"Trump lawyers lay out voter fraud cases in Pennsylvania, Michigan and Wisconsin",STEAL
t3_jx3pwj,Obama’s Grotesque Self-Revisionism -- The former president's assessment of Trump ignores his own administration’s lawlessness.,DOMESTIC
t3_jxhdtu,"Lin Wood Savagely Schools Fox News' Dana Perino, Who Suggested Dominion Should Sue Trump's Legal Team",MEDIA
t3_jxbe9e,Trump Admin Brings Hammer Down on 'Anti-Semitic' Movement Targeting Israel,DOMESTIC
t3_jxbvvu,"After Death Threats At Pro-Trump Rally, Milwaukee Health Inspectors Will Get Police Escorts",
t3_jxc440,"Trump Campaign Withdrawing Lawsuit in Michigan After Wayne County ‘Relief,’ Says Giuliani",LEGAL
t3_jx5en9,Trump Announces a Press Conference and a ‘Viable Path to Victory’,
t3_jxnymp,About 73% Biden Vote Margin Gain in PA from Areas Given $18 Million by Zuckerberg-Funded ‘Safe Elections’ Project,VOTE COUNT
t3_jxnpyw,"Kavanaugh should face new investigation, Biden transition official Barbara McQuade wrote",DOMESTIC
t3_jxfz49,Berkeley Prof Compares Trump Supporters to Germans Under Nazi Rule and likens coronavirus pandemic to the Holocaust,COVID
t3_jxa78e,Trump Lawyer in PA Placed Under Protection After ‘Threats of Harm’,LEGAL
t3_jxeepb,Trump Campaign Lawyers: There Is a Pattern of Planned Voter Fraud in Multiple States,STEAL
t3_jxfwdu,Trump Summons Michigan GOP Leaders for Extraordinary Meeting,DOMESTIC
t3_jxhdu1,Trump Administration To Unveil Drug Price Regs,DOMESTIC
t3_jxby2q,Biden vows there will be no national shutdown,COVID
t3_jwv98q,Satire: Obama Horrified As Trump Undoes His Years Of Hard Work Bombing The Middle East,
t3_jxcct9,Atlanta Mayor Suggests Trump Would ‘Eat His Own Children’ To Advance Agenda | The Daily Wire,MEDIA
t3_jxfzyg,"Embarrassing Lapdog Biden Journalists Debase Their Profession in Latest Presser: ""What did you say to Americans, especially immigrant Americans who came to the United States, looking for political stability and are seeing all the things that the President is doing?""",MEDIA
t3_jx1sgf,Trump campaign lawyer under protection following ‘threats of harm’,LEGAL
t3_jxe10r,The Hill’s Joe Concha Takes Blowtorch to Pro-Biden ‘Marshmallow Media’,MEDIA
t3_jxd9d2,Biden declares there will be 'no national shutdown',COVID
t3_jxtere,"Biden turns 78, officially making him oldest president-elect",DOMESTIC
t3_jx2fu6,Democrats And Media Are Reaping Fruit Of 4 Years Of Anti-Trump Conspiracy Theories,DOMESTIC
t3_jxh1k3,Satire: NRA Presents Biden With Prestigious 'Gun Salesman Of The Month' Award,
t3_jwrln9,"Biden taps son Hunter as Food Drug Commissioner. “I don’t know about the food part, but my boy knows drugs.""",DOMESTIC
t3_jxd6kl,Biden Wants Billions in Taxes from Firearms Owners,DOMESTIC
t3_jx0tiu,"Biden/Harris Would be a Disaster for the Middle East and American Jews. Non-Jews are bewildered by the voting patterns and ideology of American Jews who are predominantly tethered to the Democrat party, do not prioritize Israel as a voting concern, and support actual Jew-haters and Israel-bashers.",DOMESTIC
t3_jwusi8,'They want Kamala in there tomorrow': Limbaugh says Dems to dump Biden -- 'They have no intention of this guy serving a full 4-year term',DOMESTIC
t3_jxadaq,Trump invites GOP Michigan lawmakers to White House amid challenge to election results,STEAL
t3_jxrtzo,Top Border Officials Warn About Disastrous Effects of Biden's Promise to Stop Building the Border Wall,DOMESTIC
t3_jx8xgj,"Trump Campaign Withdraws Lawsuit in Michigan After Wayne County 'Relief,' Says Giuliani",LEGAL
t3_jxrjjv,"Whoa: Nearly a Third of Democrats Believe the Election Was Stolen From Trump (Not that polls mean that much, but wow.)",STEAL
t3_jx1x2n,One Of Biden’s First Admin Hires Helped Push Through China Trade Bill That Caused ‘Sharp Drop’ In US Jobs,FOREIGN
t3_jx72ad,DNC Member Rants: ‘Deprogram’ 75 Million Trump Supporters,
t3_jwx3lm,Georgia Audit Catches Third Batch Of Uncounted Votes Favoring Trump,STEAL
t3_jxd4aq,'Climate action is tied to reproductive justice': AOC says the Biden administration has committed to a $2 trillion climate plan,DOMESTIC
t3_jxkgxv,Report: Biden’s proposed gun control plan could hit gun owners with $34 billion in taxes,DOMESTIC
t3_jx8jee,Biden Says He Will Admit and Grant Permanent Status to Immigrants Who Go on Food Stamps and Medicaid,DOMESTIC
t3_jxdfle,Jennifer Dillon crunched the data to s̵t̵e̵e̵r̵ ̵ steal Biden’s success,STEAL
t3_jx9dn9,Trump Campaign Holds Press Conference to Outline 'Viable Path to Victory',
t3_jxtui5,Here Are Some Major Reasons Why It's Hard to Believe the Biden Numbers,STEAL
t3_jwqagl,"Georgia Republican Poll Watcher Discovered Recount Error Off By More Than 9,000 Votes Wrongly Given To Biden",STEAL
t3_jxpgk3,"Birthday Time: Biden Turns 78, If Confirmed Will Be Oldest US President",DOMESTIC
t3_jxbvrc,9 Key Points from Trump Campaign Press Conference on Challenges to Election Results,STEAL
t3_jx6tre,"Larry Elder: ""Biden to ‘Racist’ Trump Voters: ‘Let’s Heal’""",DOMESTIC
t3_jx876e,Biden Coronavirus Task Force’s Osterholm: 'We’re Going to See Hospitals Collapsing in the Next Two to Three Weeks',COVID
t3_jws5e3,'Keep fighting': Second Trump rally in Washington set to protest electoral college vote,STEAL
t3_jxsqbc,Do Trump’s Lawyers Know What They Are Doing?,LEGAL
t3_jws6qh,"Ga. GOP: Biden got 9,626 votes in Dekalb County by mistake",STEAL
t3_jxoj2j,"Biden turns 78, will be oldest US president",DOMESTIC
